product_title,user_name,rating,review,review_date,ID
OnePlus 9 Winter,Monkey D jesse,5.0,extremely quick charging decent camera fast performance surprised long battery lasts even features hardware worked right box without nothing put sim card,"May 13, 2023",351
OnePlus 9 Winter,Monkey D jesse,4.0,product arrived excellent condition functionality great package perfect phone work properly except lifetime battery phone phone hardly lasts hours without charge would like know thats normal phone phone brand new,"September 18, 2021",352
OnePlus 9 Winter,De Wilhelmsen,1.0,less years light use games reading articles using basic phone functions phone decides qualcomm crashdump mode bricked cant anything reset access data fix issue phone stuck black screen qualcomm crashdump mode written lost lot important data family pictures notes phone numbers phone literally new even years old yet scratch took care completely useless required download complicated programs try get phone working lose data fix problem complicated go wrong many ways split second phone gone last time ever ever buy oneplus product buy phone paid came bricked bricked bricked hope company goes business f oneplus,"June 14, 2023",353
OnePlus 9 Winter,Steve,5.0,really like phone replaces moto g power hated phone reminds xiaomi mi lite one supports great fingerprint reader nice touch motions fact got day amazon special makes even nicer,"September 27, 2022",354
OnePlus 9 Winter,wilfry moya,5.0,guess thank att turning g network forcing upgrade happy upgrade buy cry bought since latest time happy look feel performance mobile device,"July 23, 2022",355
OnePlus 9 Winter,Wisam,3.0,battery ok fast charge phone believe unlocked third party sell totally fine check setting said chip snapdragon updated shows really want know,"January 6, 2023",356
OnePlus 9 Winter,Caterpro,4.0,advertize day shipping cant deliver ontime hard phone works great,"September 29, 2022",357
OnePlus 9 Winter,Using my VPN,4.0,phone battery life good,"January 12, 2023",358
OnePlus 9 Winter,Tony,5.0,una de las mejores compras el teléfono está desbloqueado aunque trae los logos de tmobile pero está desbloqueado funciona de maravilla con la operadora cnt de ecuador es muy rápido cámaras muy buenas hasta el momento ni una sola observación,"February 20, 2023",359
OnePlus 9 Winter,Stephan Kokinda,5.0,este producto lo utilicé como regalo mi pareja hubiese gustado ese mismo modelo para mí pero de gb de toda forma si ofrecieran un regalo de ese mismo dispositivo le haría una buena review con video unboxing para ustedes,"January 27, 2023",360
OnePlus 9 Winter,SC,5.0,didnt want get new phone however att retiring old network g oneplus longer work making sure one would grabbed super smooth updated processor bigger battery finally added wireless charging missed much phones oneplus great company phone overheat like big,"June 6, 2021",361
OnePlus 9 Winter,Reyney Fernández Curet,3.0,one amazing phone specs phone kicks ass day prices om phones days horrible one definitely reasonable pricing great specsedit oneplus releases shitty updates recently os couple things keep breaking also added dumb features make things harder get along issue seems constant amongst oneplus devices hear others call cant hear still decent phone definitely wont buy,"May 23, 2021",362
OnePlus 9 Winter,JAP73,4.0,though new iteration oneplus phone says charges wirelessly fickle charging capability battery last long oneplus havent long enough appreciate hasselblad camera,"June 28, 2021",363
OnePlus 9 Winter,joel,5.0,el celular lo pedí para usarlo en méxico aunque aplican las comisiones de importación ya con la conversión pesos creo que fue una buena compra debido que es un modelo nuevo prefiero el sistema operativo android el envío fue rápido llegó como semanas antes de la fecha prevista el celular lo uso con la compañía de telcel hubo ningún problema al ser este un dispositivo desbloqueado de ahí en fuera si gustó todo lo que incluye el celular,"May 2, 2021",364
OnePlus 9 Winter,tipsters,1.0,ive phone since february far worst phone ive ever glitchy reason terrible camera general bad performance around mention handles mms messages like came im switching iphone new one comes ive wanted spike stupid thing ground multiple times im time actually comes gloriouson flip side oneplus years best phone ive ever figured upgrade would go another oneplus horribly wrong favor get literally phone go samsung even lg something,"August 26, 2023",365
OnePlus 9 Winter,Noé G,1.0,took figure outamazon supposed selling us version phone model lesomehow received model le asian version supposed sold china indiaits really hard tell label chinese le model number check details settings tell le main physical difference two us version wireless charging asian version whole security issue thingi send back spending afternoon updating itif dont issue using asian version phone equal previous years old top tier samsung phones dont sell asian version may security issues claim us version,"January 5, 2023",366
OnePlus 9 Winter,Brian Smith,5.0,third oneplus phone continue fanthe battery life good fingerprint reader bit tendency recognize prints mostly works,"November 7, 2022",367
OnePlus 9 Winter,RC,5.0,excelente equipo vengo de un mobil con mayor capcidad de carga por ello noto la diferencia sin embargo el móvil por todo lo demás es superior actualizado rápidamente android lo mejor,"November 16, 2022",368
OnePlus 9 Winter,Tony,5.0,ive oneplus oneplus oneplus spectacular deal great phone last year camera amazing love live oneplus,"December 31, 2022",369
OnePlus 9 Winter,Stephan Kokinda,5.0,great phone th oneplus phone love every single one complain rock screen smooth great phone,"November 19, 2022",370
OnePlus 9 Winter,JP,5.0,great pictures plenty memory sleek fast charginggreat phone around,"August 5, 2023",371
OnePlus 9 Winter,Planet Mars,5.0,long apn settings right work verizon people technology illiterate blame phone instead ignorance,"February 1, 2023",372
OnePlus 9 Winter,Em,5.0,snapdragon phone gets really hot around celsius gaming one hour especially brightness high even thought winter otherwise phone great,"January 19, 2023",373
OnePlus 9 Winter,Quinton,5.0,happy phone im happy huge phones every company making,"May 10, 2023",374
OnePlus 9 Winter,Haitang D,5.0,ive phone one week love battery lasts much longer phones used easy set,"January 19, 2023",375
OnePlus 9 Winter,Rex Barker Ledon,5.0,honestly blown away many things oneplus purchased renewed phone looks feels brand new,"March 13, 2023",376
OnePlus 9 Winter,Roxanne Nanney,2.0,bought phone huge expectations fundamentally work phone calls frequent disconnect people end hear call gets disconnect even connecting network wificalling worst use tmobile enabled wificalling phone calls whatsapp calls made wifi working fairly keep reconnecting irritate us videovoice calli wouldnt recommend phone anyone since basic functionality calls issues,"November 2, 2022",377
OnePlus 9 Winter,Michael Fortine,3.0,battery drains fast youre troubled lot nice features returned,"February 19, 2023",378
OnePlus 9 Winter,Tony,1.0,update,"August 21, 2024",379
OnePlus 9 Winter,Stephan Kokinda,1.0,screen sensitivity started poor got worse three days used started slowing point couldnt anything rebooting didnt help either typing nearly impossible would skip letters id press hard letter id hold letter longer necessary restoring factory settings refused turn going die return packagingcustomization also garbage couldnt set folders icons way wanted couldnt set different sounds different notification types couldnt turn several features didnt wantthe experience overwhelming headache recommend phone,"April 29, 2023",380
OnePlus 9 Winter,C,3.0,expected dual sim phone received single sim,"January 24, 2023",381
OnePlus 9 Winter,Robyn Todd,1.0,thin persistent green line appeared screen month use havent dropped wet neither screen cellphone damage yet green line appeared nowhere one moment using whatsapp placed cellphone desk picked green line manufacturing defect shame oneplus id never buy another product brand ever,"February 3, 2024",382
OnePlus 9 Winter,Sachin Baravkar,2.0,bought phone thinking going try something new samsung excited receiving read nothing good reviews received phone noticed didnt respond touch way signal terrible ive several friends including office tried call tell phone wont even ring go voicemail phone doesnt give notifications like im supposed receiving unfortunately im going return phone id rather renewed samsung year ago one pro give phone fingerprint recognition lightning fast samsung could learn thing two,"July 14, 2021",383
OnePlus 9 Winter,Tony,3.0,pero se sobre calentaba mucho se descarga rápido es una lastima que tuve que devolver ahora probaré el n g,"December 2, 2022",384
OnePlus 9 Winter,Tony,5.0,phone incredible except amazon sent chinese version returned bought oneplus insteadcheck model number right away ends usa version,"June 16, 2022",385
OnePlus 9 Winter,David Wike,1.0,big ongoing problem randomly frequently call cant hear person end hear cant hear look around internet see lots people problem oneplus aware ignoring extremely frustrating annoying none fixes people suggest really solve problem fact look people said going years many different versions phone wide variety networks us internationallyin addition sometimes try place call drops even connects extremely unhappy phone fix cant spend money replace phone barely seven months old phone function phone doesntwork dont buy phone,"June 2, 2022",386
OnePlus 9 Winter,Manuel Bermudez,4.0,buen telefono funciono sin problemas en ecuador,"March 27, 2022",387
OnePlus 9 Winter,Michael,5.0,using months without glitch rain sun pretty much provides says description issues complaints happy customer,"October 18, 2022",388
OnePlus 9 Winter,Tony,1.0,got rid one plus phone thought defective reboot phone every wanted make call tried make call hear hear person still liked phone features upgraded brand new one plus used one week two f thing happens try call hear person reboot like old phone return phone never never get one plus think try google pixel version heard lots good things phone,"November 7, 2022",389
OnePlus 9 Winter,Stephan Kokinda,5.0,right side power button could raised left side volume buttons keeps taking unwanted screenshots,"September 29, 2022",390
OnePlus 9 Winter,Yoshee B Delight,5.0,el teléfono tiene una excelente relación calidad precio es necesario gastar una fortuna para tener un buen teléfono,"February 21, 2023",391
OnePlus 9 Winter,Kathy,5.0,still getting updates great screen performance battery lifeonly nothing else beats,"January 19, 2023",392
OnePlus 9 Winter,Pablo,5.0,excellent phone love os camera great better gcam screen super bright colors always better previous model,"August 24, 2022",393
OnePlus 9 Winter,Frank Briffa,5.0,excelente teléfono por precio calidad con uso moderado la batería dura un día carga de en min approx funciona en costa rica con movistar,"August 13, 2022",394
OnePlus 9 Winter,Camilo,5.0,la entrega del móvil fue rápida recibí el equipo en buenas condiciones como esperaba,"March 2, 2023",395
OnePlus 9 Winter,Hazel G,5.0,bought phone mom seems holding well,"December 30, 2022",396
OnePlus 9 Winter,Francisco Rodriguez,5.0,product arrived hours estimated date loved careful kind thanks,"November 13, 2022",397
OnePlus 9 Winter,bryan f,3.0,product description lists clear phone case included phone case got phone,"September 8, 2022",398
OnePlus Open 16GB,Amazon Customer,5.0,month ago decided time finally break away apple eco system sick really liked refined design fold knew wanted something felt vastly different candy bar form factorthe phone great lot features wowed ai tools fun silly screens bright vibrant got blue bubbles working home thought good goa week passed realized wasnt love damn front screen narrow little hands im small guy didnt think would bother couldnt type sentence save life cases added strange cheap bulky feeling phone made feel like carrying around tv remote inner screen damn glossy couldnt see outside even apartment matter reflected everything around covered smudges instant cant set phone flat table camera placement also uncomfortable hold sharp cornersthe one plus open fixed issues inner screen feels much premium outer screen perfect size love anti glare inside cant get shallow crease honestly even like os coming ios little inviting course miss wireless charging ai features absolutely live without cameras much better prefer tasteful image processing samsung pics look like acid trip theyre oversaturated oneplus open feels much premium carefully crafted also dont really need phones much thinneri like solid open feels dont feel like going break every time unfold may snapdragon gen gen runs extremely well battery life absolutely better even high performanceso happy join oneplus ecosystem brilliantly balanced device,"August 7, 2024",399
OnePlus Open 16GB,Dimitri,5.0,owned samsung z fold substantial changes releases sold z fold within three months ownership never enjoyed using outer screen anything especially needed enter data narrow cameras much downgrade sseries phones although pen support carrying one required thicker case already large heavy phone wear pants large pockets long skinny foldable would occasionally fall sitting downwhile z fold interface good many duplicated apps added little additional functionality including voice assistant unnecessarily increased overall complexity using phonei also purchased ultra ai built samsung apps since dont use browser voice assistant messaging mail didnt access much ai phone plus become accustomed larger inside screen missed part foldable experiencei tried pixel fold like inability easily lay flat many apps display correctly large inside screen heat issues everyday things googles pitiful history pixel phone support owned several early pixel phones loved outer screen aspect much better z foldi read several reviews oneplus open good purchased one notes farpros outer screen perfect height width typing larger thumbs face unlock accurate faster lighter z fold much lighter pixel fold charges minutes miss need wireless charging larger battery lasts longer z fold phone camera expert pictures noticably better interface much simpler streamlined minimal app duplication surprised much like open canvas multitasking implementation crease phone much closer invisible z folds pixel foldcons water dust proof splash resistant wide selection good cases,"June 5, 2024",400
OnePlus Open 16GB,Amazon Customer,1.0,bought phone months ago opened middle screen line dead pixels dropping damage screen opening action enough break trying get support got approved try click details service request get unavailable notification lots reports online hinge related inner screen damage drops physical damage open screen one day boom according documentation take weeks repair great work requires fa supposed deal without phone weeks anyway would stay away brand google sends replacement ship old phone shipping box keep new one thats legitimate company handles itupdate even though got approved repairs tech support claims record support tickets asking proof purchase pictures literally approved page phone imei get info button either system broken dont want fix defective phones,"August 21, 2024",401
OnePlus Open 16GB,Larry A,5.0,say surprised phone loyal samsung user last decade conflicted choosing fold eventually choosing phone due better screen ratios one pluss technically first folding phone first one plus phone wow wowive phone around days far gotten multiple compliments recommend phone currently due admittedly high prices folding smart phones plan recommending assumedly drops price next generation releasespros perfect foldable screen aspect ratiosunlike samsung insists thing outer folding screen assumed attempt make people want use opened form phone one plus instead offers normal outer screen meaning use like normal phone also get larger tablet factor invisible creasewhen screen folded open crease probably best currently market unable seen unless held angles would never even think looking phone unless wanted see crease battery lifeso far gotten battery regular use phone one day day first day got phone arrived battery chargingthis phone charge fast ive put charge charge around came back minutes later see fully chargedcons pricenow problem main foldable phones currently market yeah honestly see foldable becoming main stream able brought price though probably still years softwarenow dig oxygen os far feels like good skin great android os apps act weird swapping open closed modes stretch long squishing dont know apps focused working well screen sizes similar galaxy fold issue sometimes close apps swapping screens deal awkward lay outs besides though far everything great,"April 6, 2024",402
OnePlus Open 16GB,Dimitri,3.0,review mostly people current flagships looking get foldable market iphone user years recently swtiched iphone pro max galaxy ultra earlier year couldnt happier ive always itch try foldable seen one plus coming one normal side cover screen incredible specs thought id try first impressions build quality crazy nice feels great lightweight snappy open close never used foldable inner screen insane never notice crease hard feel major props one plus mostly everything see youtube reviews true ill skip question stands worth swtiching flagship answer cover screen youll probably using least time way small still compared ultra iphone pro max software isnt yet either laggy compared flagships lots apps dont work cover screen surprisingly work inner screen also apps either face id unlock biometrics samsung apple dont exist one plus frustrating type password app everytime annoying doesnt even let save regardless biometrics isnt apps like apps fitting cover screen inner ran across case note though say one plus quickest biometrics ever truly incredible lastly software phone clone sucks absolutely nothing compared apples samsungs switching brands like makes much easier convincing annoying swtiching stuff settings manually conclusion great phone incredible build quality beautiful screens amazing cameras speakers best switching another foldable probably worth going flagship probably great phone youre still giving quite things id love foldables par flagships yet,"November 30, 2023",403
OnePlus Open 16GB,Dimitri,5.0,first people either love fold cell phones hate love ive used couple samsungs z folds negative samsung z fold folded screen narrow oneplus announced going fold open excited coming one would get back oneplus family original oneplus one n theres problem launcheroperating system oxygenos flip oos microsoft launcher like variety samsung phones like change sayi like feel hand like front screen wider open screen bigger like arent bunch preinstalled stuff dont want use cant uninstall oxygenos pretty clean operating system unnecessary bloat havent remove appsi issue makingreceiving calls wifi cell provider cough tmob cough told turn wifi saying problem transparent issue cell provider branded samsung folds spotted calls wifi got response provider turn wifi yes fix sympton root causei reached oneplus support responded quickly asked information cell provider never asked shall see deal breaker unlimited callstextdata keep wifi would nice im streaming music video etcanyhow wrap great phone love fast clean love back oneplus family,"November 30, 2023",404
OnePlus Open 16GB,Jon C,4.0,wasnt supposed purchase phone let alone foldable happy surface duo user however circumstances dictate purchase new foldable duo slipped pocket dropped first screen still responsive even though cracks little little responsiveness declined luckily oneplus released time looking new foldable probably asking didnt duo repaired would could currently living us send device repair return state sidewhy select oneplus like samsung fold pixel fold one looking phone emulates surface duos ability multitask trying devices decided go oneplus open based multiple reviews online handles multiple apps time granted leap faith decision since foldable isnt available thanks opponow phone month im happy say enjoy using device quirks one widgets expandable open device left side screen move center screen deal breaker would nice see whatever widgets thats front screen middle device unfold itmicrosoft teams school work sometimes quirky device tap answer notification using screens app reason multiple sessions left side screen must navigate back close sessions respondluckily read microsoft giving love device bake link windows feature os soon oxygen ala samsung hope microsoft work issues ms teams manufacturer wellnow cons way list like devicebattery optimizer tells app draining battery battery last exceptionally longfast charging extremely fast use chargerweight noticeably light compared rest foldables ive triedand course camera different topici glad leap faith purchased device surface duo take restim giving device four stars update review oxygen os released maybe give starsupdate receiving latest update device system still marred dual screen issue apps functional tell isnt natural foldable tries run app full screen goes microsoft teams mentioned abovelink windows fully baked tell functioning shouldkeeping stars,"December 30, 2023",405
OnePlus Open 16GB,Kasey,5.0,ive two galaxy folds oneplus open leaves dust light thin sleek best foldable market,"August 27, 2024",406
OnePlus Open 16GB,JayS,5.0,closed screen easily usable handed convenient old galaxy note ultra g open screen great work especially emails spreadsheets camera amazing battery lasts day heavy use thing thought would miss stylus quickly forgotten open screen makes niche use speakers put great quality sound hundreds dollars less z fold easily best foldable buy right unbelievable value,"August 30, 2024",407
OnePlus Open 16GB,RommelS,5.0,es un excelente plegable si quieres adquirir uno eso sí compra un cover para protegerlo porque trae pero por lo demás muy bien oneplus,"August 20, 2024",408
OnePlus Open 16GB,Amazon Customer,3.0,phone slowest wifi speeds ive ever seen phone doesnt even recognize wifi rarely sees wifi wireless charging finicky plugged pc outside pixel brighter phone finger print reader works fairly well fast charging great,"September 4, 2024",409
OnePlus Open 16GB,Dimitri,2.0,context ive longtime iphone user ive taking flack ever since started working tech research best folding phone landed onei think brilliant phone comes camera screen software features oxygen os amazing hate admit far superior ios humble opinionthat said customer support device nonexistent motherinlaw accidentally dropped phone even though pretty rugged case internal screen got damaged month since started repair process one plus directly told today havent even inspected top called several phone repair shops southern california estimate might repair parts yearwhich ultimately leads thisthe fact getting device repaired pain makes completely impractical would rather inferior hardware software know accident happens device breaks get repaired replaced quickly,"September 5, 2024",410
OnePlus Open 16GB,Tobey64,5.0,titanium way stronger yet lighter pixel fold samsung razr,"August 7, 2024",411
OnePlus Open 16GB,Amazon Customer,5.0,never gon na use brand phone long oneplus around,"August 11, 2024",412
OnePlus Open 16GB,Lou,3.0,got upgrade galaxy fold totally blows watter camera responsiveness multiple app software experience much betterhowever bought one first came one month screen got dead pixel eventually went across entire inner screen fold eventually issues inner screen lasted least year issuesnormally getting replacement would issue phone doesnt allow direct replacement wait whole month rma eventually got itand within two weeks screen new phone went completely black longer turns onso think wont bother month long replacement,"May 10, 2024",413
OnePlus Open 16GB,Lou,5.0,came fold didnt offer much way basically anything different special enough upgrade however open peaked interest buying testing week say certainly best foldable however couple flaws take getting used believe feature performance make fingerprint reader pretty small meaning definitely take trys unlocking phone due small scan area wireless charging big deal definitely pain point lastly volume buttons way high big hands picks though good sign phone otherwise cameras nothing super special fine definitely need good amount light get perfect shot screens bright crease hard see barely feel made phone different battery simply outstanding day battery foldable heavy use truly remarkable even manage drain charges w included adapter meaning plug phone bathroom come back may percent back leave mins youre nearly full overall stomach price less competition buy choice pale comparison ill edit review find problems use,"November 19, 2023",414
OnePlus Open 16GB,Shannon M,3.0,wanted love phone really dont screen size good closed like regular phone open like small tablet operating software put nicely buggy personally find larger screen limited use isnt enough software optimized make valuable said stuff designed really quite niceunfortunately camera bump like mountain extremely obtrusive like really really huge absolute phone wireless charging built yes highspeed wired charging great able simply topup cars wireless charger missing convenience dropping qi charger going bed absurd absolutely excuse omitting itoverall cool idea ready prime time opinion ill going back samsung flagship soon,"February 5, 2024",415
OnePlus Open 16GB,Cesar,5.0,said far best cell ever used experimented sony xperia iphone samsung even blackberry years ago quality device simply outlying rest,"July 13, 2024",416
