product_title,user_name,rating,review,review_date,ID
OnePlus 11 5G,Eric,5.0,phone amazing literally best performing phone ive owned thus far super snappy camera takes great photos battery life amazing charging even better perfect g signals everywhere go previously owned pixel pro couldnt even get g area work could get consistent g signals home changed last days needless say phone brainer get theres nothing say,"September 5, 2023",593
OnePlus 11 5G,Owen,5.0,received yesterday day experience right design looks kinda strange first glance feel much better many details make feel surprised comfortable used apple fan years tried last year first time cant imagine alert slider even better iphone camera perfect love tunning color night mode plan test portrait mode later os much better samsung far good havent seen interface issue posted review videos guess next phone oneplus well dont want pay phones anymore,"February 23, 2023",594
OnePlus 11 5G,Rabon M,5.0,wife gets phone damn really nice good riddance samsung piece cake transfer data old phone best speakers ive heard smart phone snappy responsive fantastic picture streaming movies etc streaming smooth silk running without hitch mobile sim card,"October 5, 2023",595
OnePlus 11 5G,JackieJ,1.0,thought going great phone disappointed selling itall kinds fancy stuff make basics work floating keyboard looks fancy covers input areas keep oruxmaps etc literally renders apps unusable guess typing see picture maybe workaround could never find strange synchronization problems keep use day new line key work keep way could find turn voice commands alarm goes constantly listening transcribing interference android voice access ava google voice typing gvt maddening use basic functionality ava bar left top covers clock crazy spent hours trying figure workaround need glanceable clock apparently work google voice sim never even put sim things nonfunctional oxygenos different good reasons could describe,"May 20, 2024",596
OnePlus 10T Moonstone,joseph d papa,5.0,also got model im going new rthe battery best lasts longer almost phone charges faster phonethe drawback since charges superfast battery life starts deteriorating around year halfestimatebut main concern phone battery last long need charge best,"August 9, 2024",597
OnePlus 10T Moonstone,Alex Prine,5.0,love features love screen love cpugpu speed os absolutely love battery life charging speeeeeeedused nova launcher give back landscape home screen rotation got gamesir g galileo gamepad loaded every emulator games ive literally nerd heaven ever sincethis phone rocks games tall ps psp gamecube wii anything easehave gaming hours heat phone noticed allplaying gamecube hour lost batterywowbeen motorola samsung guy years thats nowoneplus waycompatibility gamesir g galileo icing cake setupif gamer made dont hesitate phone good paired controller great,"December 28, 2023",598
OnePlus 10T Moonstone,joseph d papa,5.0,oneplus fantastic smartphone seamlessly builds predecessor boasting large highresolution screen phone delivers visually stunning experience battery life impressive ensuring days worth usage smooth performance excellent picture quality make standout choice transitioning previous oneplus device effortless phone giftworthy option especially techsavvy dads sets apart affordability without compromising featuresa commendable move oneplus making highly competitive satisfying smartphone,"January 20, 2024",599
OnePlus 10T Moonstone,Beca H,4.0,pros powerful fast good camera selfie cam better swipe music controls music app customizable swipe controls open favorite apps screen ability sign wifi tray instead going settings every time ability connect bluetooth tray zen modecons camera lacking flagship macro lense never takes quite crisp enough pictures main cameras zoom grainy pixelated main cameras video doesnt good stabilization software trying change media output pain compared phones leaving swiping tray twice clicking menu clicking media output finally able change cant change shortcuts lock screen reason hard disable google feed screen personally find useless disable entire google app issue n well last system update red cable club app longer app menu uninstalled disabled thus requesting updates never use update shelf secondary tray essentially useful first due pedometer ability add extra widgets like wundergrounds weather suddenly cant use custom widgets remaining options suck entire tray one useful app aka good useless microsd slot sole purpose trying force pay next level submodel becoming common practice remains bs one would like new tv coming inputs try force buy higher model built xbox console upgrade get xbox streaming apps better hope never want bluray player ps case makes complete pain ass transfer videos photos clean larger screen cable connection phones always clunky compared swapping microsd oxygenos love hate thing features phones lack like customizable music swipe commands usually features work phones reason seem missing inaccessible vs wasnt overly impressed last somewhat glitchy ive phone month far seems working great major issues glitchiness happening farwhat say big step n previously seemed quite glitchy,"June 30, 2023",600
OnePlus 10T Moonstone,Ankita Mitra,5.0,first consider price oneplust might thinking overvalued unbox feel monster charger incredibly thick charging cable remember companies give box begin see really good deal charger cable worth alone great screen solid build quality fastest charger ever good quality cameras make good package switching iphone dead simple included usbc usba adapter included box iphone make sure turn optimize photos day two advance full resolution photos download phone able transfer photos messages imessage google messages app important lot saved conversations want keep apps iphone download android booted overall really like phone best part thing charges faster electronic device ive ever unbelievable plus charged sons th gen ipad air super fast thought pretty cool matter time apple start using rcs imessage making much better texting experience ios android youll ahead curve solid buy get itfyi phone activated verizon swapping sim card iphone pro max putting oneplus able get g lte g coverage improved iphone,"October 17, 2022",601
OnePlus 10T Moonstone,Tibs,5.0,affordable flagship fast operational system android slightly tweaked lot good functions like show download speed make disturb icon silent small things sure still things hz screen w charging phone beast paying gbgb makes even betteras cons wireless charging makes sense since best feature phone impressively fast charging anyways type protection whatsoever would nice waterproof dustproof especially dustproof since constantly clean screen knowing sure buy case bundle seems sturdy enough better safethis first time using oneplus phone im loving lets hope keeps way,"October 3, 2022",602
OnePlus 10T Moonstone,Scottg5150,5.0,ive phone months say happy features flagship phone except wireless charging included fast charger phone charge minutes missed gb phone super fast switches apps seamlessly gb memory never storage issue overall great phone,"May 2, 2024",603
OnePlus 10T Moonstone,Igor M,1.0,phone runs well overheats point would leave red marks face phone calls even short onesso returned ups amazon hasnt given refund yet days since ups said dropped back amazon amazons website says havent gotten email support says havent live chat says running circles like different live chats multiple email replies later still nothing dont buy think may return certain also overheats bad,"November 11, 2022",604
OnePlus 10T Moonstone,justmyopinion,5.0,value using since one year till working like brand new mobile,"July 5, 2024",605
OnePlus 10T Moonstone,Alex Prine,5.0,great quality great price amazing running system excellent customer support best phone ever owned great phone get oneplus switched oneplus r highly reccomend never issue model ram enough expand vram makes experience smooth easily nicest brand phone budget,"April 30, 2024",606
OnePlus 10T Moonstone,joseph d papa,5.0,phone like toyota runner high quality runs well phone theres nothing crazy screen flat battery great complaints performance display smooth colorful dont think much thats exactly love phone timealso im really clumsy drop thing lot nothing single scratch yet still impressed integrity oneplus phones note use screen protector thin case,"February 23, 2024",607
OnePlus 10T Moonstone,Alex Prine,5.0,performance really solid phone far screen crisp easy type camera decent better also x cost want dang good battery quality running phone itit runs android able back everything using google like phone convenient easy transfer data phoneive phones like galaxy motorola likes well one simply performs beyond expectation price vs competition really nice phone reasonably priced isnt really slow far behind tech missing outgive go solid phone,"November 8, 2023",608
OnePlus 10T Moonstone,Alex Kreitz,4.0,general pretty good phone price g ram snapdragon henplus good gaming daily life use even though chargeing downgraded w w compared chinese version tbut still fast battery life acceptable due mid size mah battery main camera pretty good ultra wide marco good enough something thats disappointing sim card slot doesnt free case box btw chinese version good colored soft case depends color buying screen regular p hz boe screen without dc dimming high frequency pwm dimming eyes sensitive maybe best choice overall best phone get amazon price really recommend get g ram version make phone last longer future,"January 14, 2023",609
OnePlus 10T Moonstone,Matthew Diederichs,3.0,loyal oneplus since got oneplus upgraded phone every year optpro used two half yearsi replace dropped screen broke shame loved popup camera thought time move anywayi looked optpro screen repairs expensive decided take advantage op deal buy without much research trusting brandi regret decision phone flagship camera main camera zoom blurry stabilization software poor dual sim card slot worst alert sliders feature made op phones stand resti know could avoided issues read descriptions buying never expected op lower standards much recent phones maybe time look alternativesif op fan like disappointed phone,"July 13, 2023",610
OnePlus 10T Moonstone,jim,4.0,complaint wireless charging hand thing charges faster phone period right super vooc setup,"December 12, 2023",611
OnePlus 10T Moonstone,Carlos Velasquez,5.0,battery life super matters work field accubattery shows avg discharge current mah pixel mah battery life reflects usually charge end day still typically phone hrs day unlike pixel charge end day less great buy one thing noticed set phone battery saver kicks might mess wifi internet connection would turn onoff mode ive disabled feature battery life still great connection solidi would gotten samsung bloatware cant deleteremove oneplus bloatwarefingerprint reader far better pixel still perfect usually use facial recognition unlock phonepixel takes better pictures,"November 29, 2022",612
OnePlus 10T Moonstone,Andrew J Cyvas,5.0,bright responsive screen dual wifi connections ultra fast charging full charge min long lasting dual cell battery low heat output android highest tier processor time reviewthis phone goes beyond pay isnt super fancy first look packed many latest cutting edge technology almost half price competitorsim using phone us tmobile g carrier issues farupdate using phone month im still impressed everything still runs smooth cant imagine using another phone without ultra fast chargingonly ran minor issues first im able register phone oneplus red cable club isnt essential missing free month extended warranty promotions second optimized night charging always set sure intended could even issue android regardless doesnt affect performance phone rate charging,"October 2, 2022",613
OnePlus 10T Moonstone,SuperJoat,4.0,phone features think important charges minutes couple days moderate use minutes daily use also slows charging nights plug every nightruns smooth display good enough outdoorsi dont play games use banking browsing web important things long lasting battery quick charging hz display good cpu toolarge sizefor price good phonethings dont matter phone back made metal memory expansion current ax wifi g better solution data storage great camera brand name metal phone backs kind lame everyone know nonmetal protective casesleeve phones,"October 26, 2022",614
OnePlus 10T Moonstone,Rae,5.0,enjoyed phone greatly speaker loud device ran quickly enjoyed main reason returned bc needed better selfie camera btw dont know phone going live selfie camera desires,"February 9, 2024",615
OnePlus 10T Moonstone,K Guillory,5.0,first oneplus phone im blown away ive phone month use phone day every day last almost full day fastest charging phone ive ever phone within minutes less super fast going screen screen issues connecting wifi bluetooth accessing apps love love fingerprint scan front bottom screen issue fingerprint scan side back phone far complaintsfyi took days warranty recognized settings registered device clicked one plus red cable club dont alarmed dont see year warranty immediately,"February 19, 2023",616
OnePlus 10T Moonstone,joseph d papa,5.0,love phone looking preferences great battery phone need able get good deal phone criminally underrated like take pictures phone like preferences phone definitely one best,"December 26, 2023",617
OnePlus 10T Moonstone,Alex Prine,4.0,gig memory fast would great little bigger screen tb storage,"October 22, 2023",618
OnePlus 10T Moonstone,Carlos Orellana,5.0,great charging fastest way gaming experience hyper genshin impact performance heat dispersion demanding games love works phone beautiful people around ask got thanks oneplus finally quitting iphone decade,"December 23, 2023",619
OnePlus 10T Moonstone,Wilson Baird,5.0,im big oneplus fan boy starting oneplus one oneplus one oneplus oneplus owning oneplus never stopped amazing everytime bought phone im never able go back brands purely stock android experience give everytime buy oneplus always unique features time came beast charger w complaint gets charged mins never seen lag al get experience get iphone samsungs half price got gb gb variant steal deal would say features offer know missing alert slider miss im okay,"January 14, 2023",620
OnePlus 10T Moonstone,PeterChiaki,5.0,two pros like better great phone,"March 2, 2024",621
OnePlus 10T Moonstone,Ijaz Ahamed,5.0,charging speed top line sure phone processing chip ultra snapdragon gen performs good cameras good special purchased brand new tax compared ultra brand new tax got gb gb ram im pleased oneplus,"September 26, 2023",622
OnePlus 10T Moonstone,MikeL,5.0,phone oneplus works tmobile issuesdoes normal stuff play games text photos alarm clock flashlight watch movies apparently also uses make receive telephone callsno problems working android auto oneplus phones problemsnot recommended use flotation device sinks,"September 27, 2023",623
OnePlus 10T Moonstone,Muhammad Nageen,5.0,previous phone lg stylo liked lot several years old plus lg longer makes phones updates software android software mostly although updated since lg primary likes size weight largest screen fits pocket choose use bright sharp clear battery life generous oversized charger quickly recharge phone overnight recharge routine lastly speed processing games boot faster play without fail photos also impressive tough say opinion price point believe one terrific value,"November 14, 2022",624
OnePlus 10T Moonstone,Cyril,4.0,finger print face unlock super fastgood camera oudio really good,"September 3, 2023",625
OnePlus 10T Moonstone,CNC_Geek,4.0,overall love phone dont listen reviews say dont need screen protector dont quite believe screen gorilla glass ive several phones never one crack good case one short drop boom cracked,"May 4, 2023",626
OnePlus 10T Moonstone,joseph d papa,4.0,tried flagship phones found gem samsung happy pre installed programs pixel ended strange noise like something come loose inside phone well worth fast charging bright screen solid build thank oneplus updatedsome features like raise wake double tap wake stop working suddenly find way fix latest update battery life dropped significantly since new,"December 20, 2022",627
OnePlus 10T Moonstone,Alex Prine,5.0,liked one plus much bought could benefit g new router providedjust quick note using att reason unable make calls could receive calls attempted dial received providers unable complete call dialed error message frustration brought phone local att store longer sell one plus phones store associate escalated issue problem addressed im happy phone especially drop price,"May 30, 2023",628
OnePlus 10T Moonstone,Tim,5.0,el telefono sin ningun problema el tiempo de entrega sin problema pues en el telefono es toda una maquina,"December 25, 2023",629
OnePlus 10T Moonstone,Keith Newby,5.0,phone great far quite impressive design performance really love fast charging pretty impressive,"December 16, 2023",630
OnePlus 10T Moonstone,César Huembes,5.0,upgrade model tend use devices longer perform receiving service updates third oneplus although savings samsung shrank performance still par flagship models,"August 25, 2023",631
OnePlus 10T Moonstone,Ajay Pal,4.0,dont get wrong phone amazing however ive issues couple used applications never issue previous oneplus fingerprint reader seems finicky amount money pay phone everything breeze,"March 14, 2023",632
OnePlus 10T Moonstone,Victors Confidential,5.0,time samsung apple make pay phone large screen oneplus save money fantastic phone blazing fast charging speeds incredible beautiful oled screen inches flat display thank goodness battery life way better pixel cameras good pixel series still take good photos overall incredible value purchase dont see would disappointed,"February 25, 2023",633
OnePlus 10T Moonstone,Marco Vaca Salvador,5.0,best cell phone ive oxygen os works great super fast charging,"January 10, 2024",634
OnePlus 10T Moonstone,Hunter,5.0,flagship phones tell oneplus right top fast fast faster charging super speedy todays world critical scrolling silky smooth lag opening application phone feels good hands nothing looks cheap one thing would recommend anyone buying get case soon possible back glass little bit slick would definitely recommend phone anyone looking quality phone great price,"October 11, 2022",635
OnePlus 10T Moonstone,Brad Salata,5.0,works exactly problems phone arrived quickly exactly expected support sent message making sure knew contact issuesvery good business,"October 11, 2023",636
OnePlus 10T Moonstone,joseph d papa,3.0,phone issues staying connected bluetooth devices unfortunately past return period im stuck,"December 1, 2023",637
OnePlus 10T Moonstone,Alex Prine,5.0,att finally allows oneplus g network previously pixel phone massive upgrade feels sturdy lightning fast charging great actually see screen sun wont find better phone price even hundred camera isnt good galaxy pixel pretty good also curved screen means screen protectors fit stay ononeplus finally going back flagship killers like past,"October 11, 2022",638
OnePlus 10T Moonstone,Carlos Zavala,4.0,best phone ive ever owned give stars cause finger print doesnt wan na work time reason great phone gaming anything else,"January 24, 2023",639
OnePlus 10T Moonstone,Doc N,4.0,like phone took time figure things note gave mom battery life great listen lot music day better note,"November 2, 2022",640
OnePlus 10T Moonstone,Lee,5.0,phone amazing days using charging unreal full battery minutes os smooth top line processor snapdragon gen surprised phone reading lot bad reviews camera actually really enjoy went ultra phone althought good ultra dont really view drop,"October 3, 2022",641
OnePlus 10T Moonstone,kevin walters,5.0,complaint phone looks nice runs flawless smoothly charges super fast full less minutes impressed dont know much camera quality dont care long takes decent photos happy test soon snapdragon gen gb ram gb memory cant go wrong,"October 10, 2022",642
OnePlus 10T Moonstone,Schultz,5.0,exelente cambio de galaxy este todo funciona perfecto lástima que tenga ranura de expansión sd micro pero tiene buena memoria ram expandible,"September 12, 2023",643
OnePlus 10T Moonstone,Vannara Lim,5.0,awesome powerperformance great price oneplus fan life con took away silent switch,"September 6, 2023",644
OnePlus 10T Moonstone,Nacho,5.0,really turned really good phone price reasonable speed overall great overall good battery life comparison new phones camera takes high resolution pictures well really impressed able tradein receive credit amazon great deal overall would definitely recommend,"November 12, 2022",645
OnePlus 10T Moonstone,Thomas,2.0,months phone stopped charging also significantly expensive today bought november last year skip,"April 17, 2024",646
OnePlus 10T Moonstone,joseph d papa,3.0,love phone phone came usb c usb c cable charger block usb slot charge phone without additional purchase,"August 2, 2023",647
OnePlus 10T Moonstone,Alex Prine,5.0,compre este telefono como segundo móvil el telefono es muy completo la fluidez la camara todo son dignos de un telefono de vengo de iphone la verdad que es muy buena alternativa lo mas destacable es la pantalla la camara la batería que tienen nada que envidiar un iphone,"February 19, 2023",648
OnePlus 10T Moonstone,John Doktor,5.0,good choice price fast easy customize,"September 13, 2023",649
OnePlus 10T Moonstone,Jorge Salas Mora,2.0,year half battery original capacity love fast charge would love charge could terminate automatically,"March 29, 2024",650
OnePlus 10T Moonstone,gw,5.0,snappy phone love supervoc charging mins full charge lasts day complaint camera ok,"July 9, 2023",651
OnePlus 10T Moonstone,DC Electric,5.0,find phone spending years red magic series phones phone everything need photo quality video quality top tier speed better life also top tier zero complaints months phone,"February 24, 2023",652
OnePlus 10T Moonstone,DC Electric,3.0,th oneplus phone ive really happy phones started tthe isnt dual sim alert slider something ill get used im almost tempted go back facial recognition seems slower hope next model comes dual sim alert slider,"December 9, 2022",653
OnePlus 10T Moonstone,ODell,5.0,todo muy bien,"October 24, 2023",654
OnePlus 10T Moonstone,Jonathan Feliciano,5.0,phone need features well done,"September 13, 2023",655
OnePlus 10T Moonstone,Eybo49,5.0,exactly expected runs beautifully,"September 22, 2023",656
OnePlus 10T Moonstone,joseph d papa,2.0,phone plastic phone wrapped corning glass didnt homework oneplus sold super fast charging great battery life pretty outside even came charger power cord like apple samsung use doi guess im pickle speed demon holds charge days fact still plastic bugs slippery like fish im old man arthritis cheersps clear plastic part review means built around plastic frame metal accents,"April 21, 2023",657
OnePlus 10T Moonstone,Alex Prine,2.0,oneplus crack screen response much faster oneplus navigate app app tell sluggish seems like mini delay constantly factory reset issues none transfer phone meaning nothing transfer one phone new phone issuesit took days decide upgrade first day tested oneplus next day shipped backim one first thousand oneplus customer day one trust maybe bad batch phone bit oneplus waste timeill using oneplus pro,"December 7, 2022",658
OnePlus 10T Moonstone,Bassetbob,1.0,ive phone almost year different still havent figured basic use updated hate updates cant find undo want beloved moto back least could use im cant afford internet depend cell phone everything throw phone far go one day rake hundreds another dumbphone,"May 12, 2024",659
OnePlus 10T Moonstone,Raul,5.0,nd one plus disappointed charges super fast needed knows charge slow never gets warm smart phone,"May 6, 2023",660
OnePlus 10T Moonstone,MS,2.0,screen doesnt respond power button hit one twenty thirty times correction take screenshot hitting power button itll show lock screen screenshot doesnt let see ita ton individually annoying software issues get put together make phone hassle add lack decent phone cases availableat point im going switch back budget nord n g obviously coming conclusion return period,"July 27, 2023",661
OnePlus 10T Moonstone,CrazyGeo,5.0,super fast battery life decent charges super fastthat need phone also good value money,"April 3, 2023",662
OnePlus 10T Moonstone,Aiden,1.0,like title says phone charger thing got box usb cable,"August 4, 2024",663
OnePlus 10T Moonstone,Moyabo,5.0,upgraded oneplus satisfied quality,"June 30, 2023",664
OnePlus 10T Moonstone,luckyjames,2.0,seemed like run mill android definitely overpricedi paid cash amazon taking days refund warned,"February 7, 2024",665
OnePlus 10T Moonstone,NEW YORKER,5.0,phone everything phones literally half price less want great android phone dont hesitate,"March 30, 2023",666
OnePlus 10T Moonstone,joseph d papa,5.0,processing system fast loud clear speakers high quality pics great price big fan oneplus bigger brands like iphone samsung especially pixels,"February 13, 2023",667
OnePlus 10T Moonstone,joseph d papa,5.0,good bright hz screen responsive quick phone price dont think beat,"October 4, 2022",668
OnePlus 10T Moonstone,Alex Prine,5.0,battery life great fast charging awesome great quality,"December 31, 2022",669
OnePlus 10T Moonstone,marshall,5.0,girlfriend got got phone wins every category,"September 30, 2022",670
OnePlus 10T Moonstone,Martin C,5.0,easy competes samsung top phones,"April 26, 2023",671
OnePlus 10T Moonstone,John z,5.0,thats,"May 9, 2023",672
OnePlus 10T Moonstone,Lawrence Maquilon,5.0,charge minutes battery life incredible,"October 31, 2022",673
