product_title,user_name,rating,review,review_date,ID
OnePlus 8 Pro,Carroll Prescott,5.0,best festures scrolling liquid smooth warp charging shipped wireless chargers air express cn free shipping apps load fast handles huge pdfs like threadripper well almost awesome dpi screen looks good amoled battery life hz qhd display vowifi works google fi although vowifi toggle doesnt appear sim settings fi sim installed vowifi toggle appear tmo sim installed vowifi work fi following magic sequence fi support send even though wont see vowifi icon notification barworst features cant get fingerprint recognition work biggie since ive never seen fingerprint recognition work wet fingers phone revert pin code anyway cameras excellent sensors sony image processing good pixelive every nexus pixel phone returned pixel kept pupdate month ownership regrets problems oxygenos update nov dual sim works gg google fi second sim fi sim im using fi sim att prepaid sim p places state hawaii tmo bars att bars,"December 16, 2020",887
OnePlus 8 Pro,Mark,4.0,got phone tried copy stuff old phone took several attempts finally able copy itone unpleasant surprise notification light new messages email sms wapp missed calls tried called horizon light useless blinks get message stops would helpful blinks stays continuously check messages lack basic visual notification unexcusablesecond surprise comes preinstalled junk get rid netflix youtube etcthe battery holds ok days lasted days using bluetooth speaker headphones whapp talkmessaging email gaming video streaming charges fast mins albeit bit slower advertisedall phone ok price,"October 17, 2021",888
OnePlus 8 Pro,Dylan Whisnant,3.0,first unlocked phone ive ever bought took phone verizon activate etc near smooth process hoped would ive phone month real complaints beginning process getting activated built alexa funtionality built alexa functionality important reason bought unlocked phone rather getting one directly cell provider however recently ive also issues screen keyboard go away suppose tobuilt alexa functionality rarely triggers via keyword first time say usually takes times trigger get message connect network lot home phone usually feet router netgear nighthawk ax ax router notice network issues devicesi dont know alexa issues phone related amazon related ive never alexa built phone compare experience anyone thats alexa built phone would love know experience itat point im strongly thinking returning phone get new things expectation everything works suppose worki say one thing really like phone display whitest white ive ever seen display computer phone,"August 6, 2020",889
OnePlus 8 Pro,Din Carpati,5.0,oneplus pro gb storage accounting lower price isnt worth extra money storage someone else might money upgrade th oneplus device definitely best right im impressed g signal get tmobile network bar signal strength like full strength g problem sending receiving pictures weak signalthe thing mention much fun camera play time ive taken hours one day go different features slowmo time lapse color filter panarama megapixel megapixel dont time play settings camera still simply take great shotthe bigger battery nice normal day work would listen music bluetooth headphones hours normal check send messages gander news headlines lunch still battery end daythe software oneplus really good allows set different things taste wall paper icons themes ringtones external storage vibrations name fewthis basically highlight real device,"June 15, 2020",890
OnePlus 8 Pro,Ryan G,5.0,oneplus best option wont want shell much money samsungor dont want shell money unproven google pixel seriesreason bought phone oneplus zero complains enticed trying true stock android experience year use switched pixel xl god mistake warranty replacements couldnt wait trading phone buy oneplus traded amazon decide oneplus pro oneplus one flat screen advantage excellent camera chose camera flat screenother surviving edge im happy phone hopefully want updated oneplus pro doesnt edge im every year buyerps buy phone see phone inperson curved edges walk mobile costco wee see phone curved edges experience decide buy else may end hating purchase also remember finding tempered glass protector next impossible,"December 5, 2020",891
OnePlus 8 Pro,DB,3.0,tons money high expectations three months ownershipnegativestwo months ownership company disabled one four cameras nearir camera ota update camera pretty cool fun got cool shots extremely unimpressed legally remove hardware feature phone without telling refunding price tagthe screen glass fragile im bummed years gorilla glass hasnt improved screen protectors curved screen awful remoced crappy one week new one came permanent almost chip like scratch didnt drop anythingdual sim still supported time despite promised bad cell service fixed updateinscreen fingerprint still unimpressive compared old normal fingerprint sensors slower less consistant usablepositivesthe mp camera amazing pure bliss use k videos smooth stills gorgeous great color detail wish could make mp default unimpressed mp modescreen beautiful bright smooth wish flat edges instead curved color inconsistancies greys low backlightbattery life charging options great warp fast quickcharge convienent wireless charging nice always use full resolution hzperformance excellentoverall last long time overall pleased wish stuff worked correctly,"August 9, 2020",892
OnePlus 8 Pro,DB,5.0,got phone today im super impressed overall look feel phone im switching galaxy note worthy upgrade phone brought everything need get started use google transfer data oneplus switch app super simple migrate love color finish blue model isnt finger print magnet green tint upgrade install shortly getting set sure fixes issue didnt notice display finger print sensor face unlock super snappy far couldnt happier update weekswhat got boxphonechargercharging cableclear phone casex screen protectors best glue holds well around edges got bubbles mine fault installim using google assistant alexa use either little weird switching samsung one ui oneplus oxygen os android like quick os feels one ui take days get used tocons wish charging cable longer camera bump bit bulky compared note,"May 11, 2020",893
OnePlus 8 Pro,Tejasvi,3.0,iphonex died days ago due water damage sanitizing ive heard many positive things phone company youtube great display great camera great battery best android os issues themin almost every app whenever touched scream would constantly count press even scrolling camera good compete iphone pro battery decent normal usage without playing game could last day unplug charger sleep would drain battery night think iphone drops less night iphone could achieve battery life smaller battery oxygenos okay perfect constantly difficulty wifi would connect disconnect use lte drop wifi completely circular reconnect would sometime still drop automatically tried another modem issue last thing want say fingerprint scanner understand requires strong bright light work screen however disturbing night using phone car night would make blind second mean phone priced would okay phone iphone gb starts pros charing fast guess iphone qc could achieve similar slower charing speedcons everything,"August 4, 2020",894
OnePlus 8 Pro,Lars Bolduc,5.0,finally gave brought oneplus pro pro nothing wrong yet tmobiles inferior g network couldnt reliably connect kitty placesafter seeing extensive g network loving monthly two lines wanted see could improve tmobile experiencewhat difference especially getting new sim card coverage outstanding phone rocks speeds ridiculously fast phone checks boxes wireless charging mhz scrolling high water resistance rating superior battery life wireless charge devices great sounding speakers larger battery warp charger included still warp charges oneplus warp car charger ability clone certain apps want two facebook accounts phone done excellent photos unlocked always timely android updates oneplusthere much price hundreds less flagship samsung iphone phonesive fan since buying oneplus th oneplus phone far best model yet,"November 5, 2020",895
OnePlus 8 Pro,SoniaLeo H,5.0,great phone great camera battery life despite advertisement alexa baked optional experience come preinstalled concerned interested thats scenario played outlight user battery took pm battery get know average screen time listed hours though hz fhd wellcamera great love super macro function night time camera coming opt upgrade welcome one roommate phone seems pummel image qualitycharges minutes beautiful finish phone keep mind comes two screen protectors didnt seem sturdy im planning getting tempered ones theyre available screen absolutely gorgeousdownsides far screen edges kind difficult navigate display fingerprint reader feels like step definitely snappy maybe need reconfigure fingerprint times cant read printi update upon use,"May 15, 2020",896
OnePlus 8 Pro,Kima,5.0,overall phone works really good screen issues device thats good fingerprint reader much faster problem advertise dual sim yet doesnt work even though mid june told oneplus support come next release penalty amazon advertising something thats disabledill update get update dual sim enabled return amazonupdate updates come still dual sim available make worse disable one cameras upgrades added filter try deceive user think camera still working using camera find hidden cameras hotelairbnb places unfortunately dont box allowed return beware want dual sim phone cameras actually keep looking phoneupdate able use dual sim installing developer preview working without issues far,"June 13, 2020",897
OnePlus 8 Pro,Mark,5.0,full disclosure coming flagship phone means previous phone moto z generally happy however got urge get something new towards end bought phone based reviews seemed like good price hardware familiar one plus allnow couple weeks happy striking difference display beautiful phone also snappy apps one thing wasnt sure would notice dont consider heavy phone user day especially working home always computer front however even days spend time phone battery seems last bedtime ask fori miss moto shortcuts otherwise dont miss old phone pleased purchase,"January 26, 2021",898
OnePlus 8 Pro,Dylan Whisnant,4.0,good phone definitely fundamental unforgiveable flaws ignoredpros speed phone fast audio quality phone superb crystal clear voice timecons dial pad tone sounds weird n weak n always seconds latency effect makes phone calling odd experience especially touching dial pads quickly vibration features completely turned found shocking people need use vibrational notification never use drains battery power hand gestureswipe features simply joke fingerprint reader low recognition accuracy feel quite annoying audiospeaker phone quality mediocre,"March 8, 2021",899
OnePlus 8 Pro,Bryan,5.0,ive owned premium phones past pros apple galaxy phones samsung budget wasnt planning buying expensive luxury came across gave shot wasnt disappointed sure doesnt wireless charging warp charging lightning quick gets job done slow phone hz makes feel smooth snappy face recognition pretty good almost instantly unlocks phone everytime show face thing payed attention battery life complaint end im heavy game user great everyday use work home camera performance decent best im photogenic im picky right touches get great photos,"October 18, 2021",900
OnePlus 8 Pro,seek11,5.0,phone sold brand new dont get let explain know phone year old dont get wrong im complaining love saving money like phone definitely flagship device super quick smooth beautiful dont fooled color name phone beautiful blue hue issues alexa transparent second oneplus device first nord n even phone surprised software experience cameras meh cameras phone decent enough call quality great screen gem phone made oneplus customer update get information dont hesitate get price hikes lol,"August 21, 2021",901
OnePlus 8 Pro,Gustavo Campos,5.0,phone pair easily drops connection odd times display random problems difficult explain annoying work well low signal areason phone calls past month keeps referring rtt exist phone place receive call party hear cant hear happens random timejust bought samsung problems allsave money get anything elseupdate march installed cricket chip phone working well paired easily doesnt drop problem seemed poor operating system,"July 1, 2022",902
OnePlus 8 Pro,Kenneth Barnes,5.0,first day one plus pro gb phone coming galaxy years ago phone clearly faster best part smooth scrolling screen looks good tend trust displaymate finger print reader instant far noticed sound phone better base plus voice youtuber sounded better speaker samsung lover ive wondering features may miss far occasionally checking samsung time fell asleep moment recall thinking atmos doubt one plus covered base didthe gs lighter bit shorter tell feels better limited one hand galaxy consideration even lighter plus think main disadvantage far im excited give new oem chance think one plus checked many boxes compelling choice ill try update regret switching oems usually try anything else,"June 18, 2020",903
OnePlus 8 Pro,Best Amazon Customer,5.0,wasnt expecting much honest switching oneplus galaxy quite upset missing features oneui spending couple hours adjusting oxygen became even better oneui performance impressive though guess everything impressive compared athe camera good though expected something betterthe battery life screen good audio average even though louder quality worse heard many complaints regarding oxygen havent tried yet hope going least good th,"December 12, 2021",904
OnePlus 8 Pro,Magic or science,4.0,ive phone months really enjoy one plus smoothness transitioning apps feels nice downside phone curved edges use plastic screen protectors theyre hassle tempered glass dont provide much protection im ok lot people say phone terrible dont see lots bang buck great audio big upgrade stars curved edges results plastic protector bubbling sitting correctly,"November 21, 2021",905
OnePlus 8 Pro,userMQ7RGL1,5.0,far phone best phone ever used date last phone pixel real complaints except getting old oneplus pro definitely noticeable bigger pixel screen also brighter better indisplay fingerprint scanner pretty cool make sure put screen protector doesnt mess phone fast far best battery life phone used far almost get days regular use also charging fast watt charging thing dont like aggressive waterfall screen goes sides definitely unwanted screen touches happens time watching videos great phone everything well little cheaper flagships samsung apple would highly recommend looking one best android phones,"June 20, 2020",906
OnePlus 8 Pro,Amazon Customer,2.0,really loved oneplus didnt lot bloat wear lot features price point someone stole phone thing keeping spirits excuse buying one plus proand one plus made sure make regret thati got device nov new infrared camera filter called xray filter deactivated upgrade summer said restored american models mine never came backthen decided switch google fi service found one plus comparable fi longer pro ti called customer support phone person hour also surprised telling aware update also screwing well either day middle downtown la miles live constant issues device totally could carrier issue although since car broke injured foot currently pleasant experience stranger call friend come get since payphones dont exist morethankfully realized end january return google fi gave decent deal ultra samsung chucked carrier sent back phone maybe wow everyone sucks much good say,"February 21, 2021",907
OnePlus 8 Pro,Mark,5.0,came galaxy note note phone superior hardware software month zero issues wish stylus like note series small sacrifice superb product affordable price tag phone lot support customization xda developers website even customizing software adding extra features get roughly hours battery life normal heavy use comparison note lasted hours similar use camera system great especially macro feature phone came minimal bloatware swiftly removed works smoothly though got today phone works great tmobile att two tested internet speed g mindblowing mbps locations strong signal wish oneplus pro version gb rom gb ram came green highly recommend,"October 4, 2020",908
OnePlus 8 Pro,Dylan Whisnant,5.0,awesome phone great price screen quality excellent photos ive taken greatwould definitely recommend phone anyone looking great flagship phone thats expensive brands like apple samsung partner samsung honestly say oneplus pro easily hold candle next actually prefer camera punch hole corner apposed samsungs centered one screenscrolling super smooth included video showing dolby atmos makes really love phonethe screen screen protector didnt expect appreciatemy qualms box phone arrived amazon wasnt packed well im glad phone survived trip could move around box amazon packed ideal something expensive sensitive bumps,"December 18, 2020",909
OnePlus 8 Pro,eren gg,4.0,incredible phone ones pluss customer service software big flaws lets start fact nicest android phone ive ever owned always nicest onesnow cons one pluss customer service terrible unfair also phone really dumb feature press power volume button accidentally easily happen gripping phone trying restart phone puts phone vibrate mode one disable option anywhere futhermore status bar doesnt even show vibrate mode oneplus forum thread talking issue since oneplus earlier still havent fixed problem much listening customers ha two big flaws mentioned phone work art,"June 24, 2020",910
OnePlus 8 Pro,Christo,4.0,theres lot say phone hardware top knotch nothing short great price doesnt feel cheap definitely attention grabber oh new iphone camera quality great speaker great slippery comes case comes preinstalled screen protector far software thats start question phones capabilities gb ram seems exaggerated would apps open connection becomes unresponsive clearing app backgrounds help dont feel slow much internet connection phone slightly poor however could router honestly planning get g service good internet connection home theres reason get device date softwares filled cool features definitely dont regret buying phone,"July 14, 2020",911
OnePlus 8 Pro,Rayhan Malik,2.0,great potential flagship phone huge disappointment others summarized good points going focus bad despite false advertising phone dual sim usa least update promised since april next update every update dual sim curved edge critical control phone scrolling back forward etc cool works great except impossible hold phone securely without activating edge controls means hold phone palm hand without touching sides easy trick makes easy drop phone edge control issue cases poorly made phone tried three including official oneplus case issue edge protector ridge interferes swiping needed edge control functions documented issue messages sms messages actually sent show unsent problem reappears time time oneplus tech supports answer totally reset phone firmware boot rom losing apps app data ignore message sent errors unacceptable flagship battery life really got lot life moto z maybe issue impressive hz display looks amazing battery life short heavy use doesnt last hours bad midrange flagship must better,"August 11, 2020",912
OnePlus 8 Pro,Baltazar Santiaqo Lopez,4.0,first time buying oneplus phone samsung galaxy user versions early initial impressions screen large easy read data transfer pretty painless big gotcha far bluetooth pairing candidate list shows mac addresses names doesnt show many devices problem identifying older samsung oneplus forums full people similar issues messed around dev settings bit luck far hoping oneplus fix via software patch isnt bt antenna problem,"January 29, 2021",913
OnePlus 8 Pro,Chicago family,5.0,reasons buy battery recharges minutes lasts days right settings stop using hz use battery saver use bedtime mode night etc phone checks constantly updates uses ton battery still get notifications instead checking every seconds checks every mins got sells msrp fast used virtually carrier camera best ever seen works well rd party camera softwareconsnonerecommendation yes much yes yes yes,"October 12, 2021",914
OnePlus 8 Pro,TechnoFiend,5.0,always buy phones based easy root completeness aftermarket firmware design hate ads use system wide adblock also want control software oneplus known community behind phones develops custom software aftermarket support extending life devicefingerprint reader miles better used g great issues signal battery decent running hz p constantly definitely increases battery drain keep mind get hours sot improve going hzif get phone new less good phone last awhile,"June 25, 2021",915
OnePlus 8 Pro,Jeremy Whitaker,3.0,replacement beloved damaged chemical leaking certainly great new capabilities especially camera g dont love like old one wireless connection little finicky size center camera make less comfortable use although guess faster find waiting pages load open new browser also im little worried screen couple tiny nicks rounded edge cant see unless light right didnt notice sliding fingers fingernail snagged one dont know whether phone arrived never dropped dont know could caused good phone money sure im little disappointed upgrade,"June 25, 2021",916
OnePlus 8 Pro,Gordon Freeman,5.0,one people uses phone years finally dies said got one old phone died im phone specs husband researching great phone affordable price think bonkers pay phone say phone fits check boxes wanted absolutely love runs really fast long battery life minimalist like coolest feature dual screen check texts still watching youtube light weight slim long one longest phones owned drawback far slide bar sound lack cute cases amazing phone highly recommend,"June 21, 2020",917
OnePlus 8 Pro,Mark,3.0,received works great far removed junk apps comes phone dont use junk app like game store even disabled shame oneplus alexa app dont uninstall dont need halfbaked g reason spend money price good dont many choices competitors kicked us price limited brands highend phones goes worth itupdate use att network cell phone signal inside house good occasionally see issues phone call tried make phone calls using one voice choppy meanwhile two phones huawei motorola worked well issue signal good,"September 4, 2021",918
OnePlus 8 Pro,Dylan Whisnant,5.0,going begin review enthusiasts stated bad reviews integrated alexa need removed app choose install people need know talking leaving troll reviewas phone awesome far oneplus pro beast phone battery life great watt charging impressive g area awesome hz refresh buttery smooth phone simply fantastic complaint screen protectors come box great make due leave lot desired moment good options glass screen protectors hoping see good ones soon,"May 14, 2020",919
OnePlus 8 Pro,Jack,4.0,great phone overall ive month downside already small crack side screen drops unsure crack came screen slightly curved edge may contributed since sticks case little upgrading completely covered case try prolong phones life,"October 19, 2021",920
OnePlus 8 Pro,Tyler,3.0,updateso wanted update review little fair phone great love switch carriers eventually going tmobile due merger jumped ship earlythe phone great still doesnt provide stars due company incorrect support phone oneplus wants update info sprint reach admit incorrect time purchase id consider going stars stars due incorrect information provided oneplusoriginalbefore purchased phone asked sprint rep oneplus rep phone would compatible oneplus stated unlocked version would sprint said unlocked would phone came hour ago unable activate sprint networkdo buy youre sprint unless want switch providers,"June 16, 2020",921
OnePlus 8 Pro,Lexy_M,4.0,overall good phone good luck trying get fingerprint register fortunately face unlock fast dont know idiot oneplus decided put crappy display fingerprinter reader combined enrollment time took tries get one fingerprint registered ridiculous also oneplus little support us email usually replies make sense ticket get passed person person say thing nothing even im still fan oneplus phones owned many since oneplus one,"August 7, 2020",922
OnePlus 8 Pro,Dustin,4.0,great phone feature rich affordable price came charger simple case screen protector unlocked works verizon contact either call web chat fully activate phone box makereceive calls send text recive thats contact verizon battery life ok probably wont last day thats price pay smooth hz p display good stereo speakers hdr support overall happy phone,"April 2, 2021",923
OnePlus 8 Pro,Daniel G Satalino,5.0,got phone replace aging galaxy bit skeptical last deviation samsung line great phone stuck till end life getting data transferred easy due android transfer starting using phone everyday tasks ensure would viable replacement say without reservation phone thoroughly impressed screen resolution refresh rate make apps smooth easy read oneplus interface isnt bloated lets configure device smallest level love thinking changing new phone would definitely add one list review work buy,"October 29, 2020",924
OnePlus 8 Pro,Jesse,5.0,great,"January 4, 2024",925
