product_title,user_name,rating,review,review_date,ID
OnePlus Nord N30,forest,5.0,bought phone recommendation friend happy im someone isnt picky technology want straightforward reliable affordable id honestly get flip phone wasnt hard get todays day age without expectation everyone smart device timeswell phone fits bill first battery life honestly baffling im joking drove minutes gmaps gps running arrived still confused single percentage point wanted something didnt obnoxiously guzzle battery got much sure long level performance last limited knowledge maintain sufficed say really amazing faras far everything else goes upgrade phone infrequently really dont know compares else even showed specs im sure isnt absolute best around tell call clarity great handheld speaker bluetooth connects quickly stays connected lot apps internet tabs open switch waiting stuff load dont worry clear im done oh camera quality clear long story short everything needs work works works well pretty easy less tech savvy person like figure outthe price point initially sold paid phone feel like excellent value devices ive seen online average nearly twice cost similarlower price poor quality sure youd get expensive ones im happy ive got heretldr need phone works get one wont disappointed,"May 19, 2024",1
OnePlus Nord N30,Drew,5.0,phone months price great phone looking something wasnt one mainstream brands like samsung apple etc like features decent storage use external storage large screen comes unlocked good battery life quick charging various widgets many settings lack bloatware comes phonethere things dont like phone compared last one google pixel aware reviews camera best sometime need really good light picture come decent otherwise pictures rather dark find editing often brighten lacks crispness get phones like google pixel others besides cool camera options like professional mode learned use im sure images would come bit brighter macro others editing tools pretty cooland something bugs enough note responsiveness screen dont think app issue happened multiple apps sometimes swiping direction doesnt always respond way want example use spotify frequently get annoyed issue spotify viewing song swipe right left change song swipe get song view taking back menu screen many times register swipe left instead registers downswipe exiting screen like said happens apps im trying swipe across instead registers downswipe exiting screen onother issues phone honestly great price im disappointed camera sometimes coming previous phones camera crisp bright also knew based reviews read swiping issue annoying tolerableoverall decent phone,"July 26, 2024",2
OnePlus Nord N30,forest,4.0,like phone good battery life charges superfast display crisp clear something like speakers allow listen lecture driving put shoulder one thing dislike probably part os delete portions message thread option delete entire thread also used quick easy way add contact info incoming text go round round trying figure os definitely improvement samsung motorola phones real bloatware automated clean app bing mobile work despite multiple bings thats ok long manually second nord oneplus phone wont last already extension tablet keyboard like cast phone bigger workviewing surface pro earbuds brand never heard seeing mint mobile pleasantly surprised usability innovations red cable recharger even speed recharges samsung work phone hard follow,"January 2, 2024",3
OnePlus Nord N30,Amazon Customer,5.0,short version got mom since habit buying cheapest samsung phones calling repeatedly weird issues fixed issuesthis phone somewhat mediocre camera solid processor plenty ram regular usage good screen lots storage oxygen os nice simple android experience comparatively cheap price chassis feels kinda cheap stick case anyway caresthe real catch gets one major android upgrade period vs think upgrades bigboy oneplus models get thats issue notable one depending kind user pay attention actual phone bits phone great,"August 10, 2024",4
OnePlus Nord N30,C Jack,5.0,samsung ultra ive battery connectivity issues able use roaming data spotty g etc went regular sim esim nothing got better decided try inexpensive backupgot phone based reviews biggest negative could find online regarding haptic feedback always turn haptics irritate thats nonissue also comments oxygenos use nova launcher devices nonissueso far good received physical sim phone company got installed immediately excellent connectivity network around town travelingthe pluses headphone jack microsd card slot battery capacity course price package includes fast charger amazing also easy mirror samsung phone via usbc usbc install particular apps runs apps would expect like spotify connectivity devices bluetooth connected perfectly vehicle yamaha guitar amp laptop another devices transferring files etcas negatives camera big downgrade samsung nowhere near quality little slower running apps expected things casehonestly phones like guitars youre buying apple dont samsung gibson fender youre paying big chunk money name excellent options fraction pricei still samsung concert videos games wifi etc couple weeks using one plus n ive come conclusion youre spending phone youre kind throwing money away,"May 27, 2024",5
OnePlus Nord N30,Fabricated,5.0,great phone pixel diemy fault thought would upgrade pixel pro pro twice cost phone glitchy crashed os constantly decided return get n delivered day sleek phone camera isnt quite quality flagship phone super happy great value easy set wasnt sure oxygen os android highly recommend arent trying spend new iphone,"August 7, 2024",6
OnePlus Nord N30,John,3.0,ive following oneplus products since beginning never opportunity get one fantastic smooth fast experience quick phone yet great battery life massive camera lenses poke little im keen look cool fingerprint scanner right side fine scanner sensitive often unlock accident simply slid correct finger sensor notknowingly big deal present display amazing clear bright responsive ui also customizable pretty cool phone comes pre installed screen protector theres cool feature phone also designate gb onboard flash memory ram effectively gb ram gnarly phone ive seen thatupdate revision unit bent indeed case sturdy one phone bent fingerprint reader volume rocker bowed significantly screen didnt crack visibly warped seems unit may fast cant handle simplest pressure suspect probably isnt metal reinforcement chassis either straight plastic glass back panel also prone scratched scraped literally anything thats semi hard sand dust slid across table seems big fan paying almost bucks phone warps months switched razr flip least thats designed bend,"February 28, 2024",7
OnePlus Nord N30,John,4.0,im conflicted even writing goes thing impressive price paidi huge samsung fan hate apple always spend money newest phone much memory offered thought last next time need phone remain relevant tech wont obsolete presumably im buying quality productthat mentality served well didnt ultra connectivity problems well really isnt old owe still tough spot fixing means bill probably north maybe would still owe money top didnt thi k either option right paying seemed expensive fixing seemed silly ultimately expensiveso short term went found cheapest phone could stomach motorola something g ram caused microsoft teams even start phone instantly crashed awhile used hotspot samsung drawbacks surethat isnt working alright still return motorola else little money might better refurb nope still anything would accept read researched finally come one plus lots nice things said phone fresh recent cheap phone experience lets say dubiousit goes sale alright ill bitei got tell hard gripe perfect nope flagship samsung phone nope give grace ram g supports virtual ram g good real ram serviceable g memory alright thats great guess supports sd card boom doesnt matter os largely free anything hate functional quirks adjusted pretty darn quick quick charge battery may worth alone thing amazes quickly charges good batteries longevity doubt however dont really care power user battery good still good enough figure id need battery maybe little meet demands fast charge though gets lower like blast supercharger minutes later im back game finger print scanner didnt think would natural useful side true dang thing works flawlessly alwaystrue downsides camera surely isnt samsung ill give props full light still photos adequate great job dark though oi oi oi hot garbage screen gets bright really needs brighter shoot dont know manageable though honestly think gripesits responsive plenty fast running things need im kind shaken im sure point ill maintain theory phone ownership goodness lets say hard time thinking new phone makes lot sense bravo one plus impressive,"December 1, 2023",8
OnePlus Nord N30,Lucian Burns,5.0,first im power user cant speak processor speed ability game time use strictly phone dont even data wifi turned dont need replaced moto stylus losing battery capacity old enough warrant replacing battery isnt easy anymorebattery life better stylus new thats saying something im around house using mobile data wifi couple days battery may drop sowhich pretty good im area lousy cell coverage phone varying towers two different time zones thats battery eater phone handles well also seems connect easier better signal stylus areas granted stylus g g house g signals everything g ltecamera im professional photographer camera seems every bit good one stylus people rate highly pictures ive taken come well im happy camerai rate audio quality handset external speaker phone calls better stylus media audio setting way overdrive volume hearing loss way loud mechangeover easier ive ever apps transferred settings passwords yesterday went set bluetooth cheap radio old truck shocked find somehow set phone functions bt audio aka sirius without pair enter numbers phone also pops tell apps running background wasting battery gives option optimize battery life greatall told dont many complaints method power instinctive prevent accidental turn offsall youre normal person looking phone first internet toy second think youll happy,"July 30, 2024",9
OnePlus Nord N30,Drew,5.0,bought dad bought one helped set saw amazing performed dad returned get new iphone wanted stay familiar apple month later bought one let tell ya somethin dont think cheap bad boy performs like nothing else dont care load time apps long takes turn onrestart thats highly irrelevant overall use performance matters thing powerhouse core gb ram expandable tb sd card yeah thing mass power ive used apps known heat heat phones performance test thing didnt get warm slightest also love allocate unused space gb help ram perform cleaner efficientlyi absolutely love phone love feels hands freedom customize android based oss actually delete apps dont want disable ones dont deleteim happy purchase specs im sure itll last years unless break reason im careful person,"August 19, 2024",10
OnePlus Nord N30,forest,4.0,bought mom gift motorola rev g years phone case bit larger previous one still operates like android subtle differences knowledge gap easy get caught onthe display nice sound impressive camera many options serve purpose picture quality nice im professional photographer im sure better cameras higher priced devices speed smoothness operating specs dont lie exact hat paying job well im impressed power supply comes supplied charger cord fast charge phone full time ive told battery last work shift,"August 28, 2024",11
OnePlus Nord N30,Drew,4.0,im happy get away samsung craziness phone sturdy battery life great oxygen os needs little help example cant voice input anything option keyboard set least mine annoying updates every week keyboard larger buttons big fingers input text apps fast would buy phone next version becomes necessary habitually drive things tractor,"August 21, 2024",12
OnePlus Nord N30,Francisco Hernandez,4.0,love nord phones dont spend lot money get great performancei started nord moved nord time new phonei got n really like phonesgreat value great price dont need pay small fortune new phone,"August 21, 2024",13
OnePlus Nord N30,Ricky S,4.0,going midrange came bite methe camera noticeable competitivethe screen tends lag n stick occasionallydecent work phone,"August 26, 2024",14
OnePlus Nord N30,Charlotte Edwards,4.0,cell bit complicated use finger print work allim country wish return cell,"August 24, 2024",15
OnePlus Nord N30,Michael,4.0,really liked phone update android finished longer rang loud enough could get fixed oneplus support returned using nord returned back amazon,"August 13, 2024",16
OnePlus Nord N30,AMaril,4.0,thot didnt come manual later found side hidden box get sim card device new sim card google sending one free ordered nice case folds stand carries cards,"July 30, 2024",17
OnePlus Nord N30,Marc Hanan,5.0,iphones moved androids found always little annoying thing thing par w last phones ive purchased found oneplus n g shortly released north america continue stick w phone long quality continues measure specs great,"August 5, 2024",18
OnePlus Nord N30,Amazon Customer,4.0,phone calls best gaming decent phone,"August 11, 2024",19
OnePlus Nord N30,Christa,5.0,teen loves phone step moto g phone every way good wifi better camera fast processor lots memory battery life seems good,"August 24, 2024",20
OnePlus Nord N30,forest,5.0,im one go flagship phones need phone good batterylife decent storage take nice pictures want personal useive phone issues need reboot every reason face recognition reliable fingerprint scanner reliable battery last days infrequent usage lasts surprisingly long time need use power saver modephone signaldata seems pretty solid compared phones provider wifi solid bluetooth solidcamera takes really nice photos personal use nightlow light feature pleasant function lot ai tools neati dont play many games ones ive looked kind resource heavy dont seem issue phonespeakers sufficiently loud clearthe microphone surprisingly clear well ive even used recording musicthis solid allaround phone someone needs general tool pocket many features want without breaking bank worth spending little phone compared cheaper budget phone,"May 20, 2024",21
OnePlus Nord N30,Drew,5.0,price pretty good im coming galaxy note ultra broke idk feels fast enough gb ram complaints fact headphone jack sd card ok camera able make payments im happy,"July 27, 2024",22
OnePlus Nord N30,raddad92,4.0,excelente equipo buena vida de batería en el uso le pide nada ningún gama alta el único pero su soporte técnico es fatal,"July 8, 2024",23
OnePlus Nord N30,nick evans,5.0,great phone hope stays way months,"August 23, 2024",24
OnePlus Nord N30,Fernando López,5.0,bought phone use work cell massive upgrade old phone price im extremely impressed,"August 13, 2024",25
OnePlus Nord N30,Me me,4.0,pros processing system good compared old phone also use work scanning items fast always thought walmart wonky app old phone slow speaker loud thats coolcons use straight talk annoying trying switch phones couldnt plug old sim buy new one keep accidentally taking screenshots want turn screen restart phone phone big handthe cons arent bad phone worth want good phone dont believe spending rent payment buying one camera every phone ive professional quality still good taking selfies,"April 7, 2024",26
OnePlus Nord N30,Eugene,5.0,didnt want buy phone phone carrier bought one put old sim card new phone followed instructions far really enjoying phone great price,"July 30, 2024",27
OnePlus Nord N30,Lou Tenant,4.0,beautiful phone still breaking despite mp camera images lackluster lighting important im still working features blazing fast performance lots features little bloat lets see handles months wanted assign camera imagesvideos taken directly microsd card available functioni still move files need helps,"June 8, 2024",28
OnePlus Nord N30,A Toole,5.0,phone im major cod mobile player ive upped game fold fine device needs fast every feature imagine pictures turn great screen size perfect great sound quality built right zero complaintsthe dual sim card perfect want one business pleasure fact convert memory ram really puts thing top g ram standard already nuts phone g total conversion could literally run major pc game bad boy,"June 24, 2024",29
OnePlus Nord N30,Ivan Doc Rodriguez,4.0,wanted phone one knows yes im person lol torn google pixel somewhere research came across article mentionedsomething negative pixel cant remember persuaded go onenord love phone solid heavy fast switching apps tabs fast charging complaints seems like wifi constantly disconnecting constantly reconnect even though set manually reconnect internet works fine work home hold phone shoulder im cooking cheeks hits buttons annoying yes ear buds lose remember last saw screen lock doesnt instead manually lock deal breaker wi fi disconnecting want look warranty info werent phone keeper im android woman dont need lot bells whistles even though im sure phone lot need find put manuallol,"December 7, 2023",30
OnePlus Nord N30,forest,5.0,bought phone physically features want also os oxygenos thoughts bothi wanted unlocked phone works tracfone wanted nfc minimum gb storage plus ability use micro sd g though g deal breaker looked became aware headphone jack rarely available new phones use daily available ni problems activating phone transferring tracfone service used tracfone sim menu available tracfone website phone functions well everything looking one physical drawback mind location volume keys power right volume left easy trying change volume press power time oxygenos power button volume key activate power menu restart power easy press unintentionally battery im happy charging day supplied charging block cable quick charge minutes overall please device sound wonderful camera good interface different previously work home use wifi calling without issuethe oxygenos part adjusted differences view os choice example phone would go sleep looking looked setting keep focus looking screen life couldnt find obvious named setting continued looking changed focus stays trying many things cant tell setting changed use niagra launcher makes change os less dramatic two apps unable uninstall red cable club oneplusclock prefer google clock ive using yearsi would buy phone features looking eliminated new phones,"October 12, 2023",31
OnePlus Nord N30,Drew,5.0,bought phone cheaper replacement samsung device succumbed wear tear use phone play video games competitively high level despite dollars cheaper samsung purchase phone better every regard faster easier use doesnt get hot easily running games high settings biometric features also consistent functional previous phone youre someone values solid performance convenient easy use interface recommend phone charges incredibly fast ive months essentially condition arrived hope see continue lastnote gaming primarily use device attest capacity demanding endeavors,"June 6, 2024",32
OnePlus Nord N30,D Johnson,4.0,dont get wrong low end phone great vivid color high resolution camera wasnt huge leap forward lg motorola phones years ago reason im blown away like lot people doesnt play k resolution video theres really nothing new thats special wish spent something little better works well enough space need ill probably hold onto long works,"April 28, 2024",33
OnePlus Nord N30,Joseph,5.0,updatei longer close apps except bc phone twisted sense humor like new setup took little getting used example added screen protector realizing came one already dont expect upgrade quite probably wont even bother looking brands oneplus way go nord n feels acts like much expensive device isoriginali never heard oneplus brand recently seem good reputation nord n kept topping list best lowercost phones took chance im glad old phone glitching lot basically acting like verge total failure wanted get something reasonable quality fortunately amazon lets pay installments interest makes big difference money tight holidays particularits thin light screen big get without ridiculous thats perfect youre dont see well anymore downside happen small hands may take getting used slightest bit reach display bright beautiful super quick lagging watch videos listen music youll notice sound quality amazing particularly earphonesi take lot photos camera important one nice ive gotten excellent pics cat really else cameras tested notoriously difficult holiday lights night well looking forward landscapes snow scenes cat thing bugs keep accidentally minimizing apps swiping close bottom functions thats something acclimate hopefully ill get soonoverall excellent choice want high quality phone doesnt cost half months rent,"December 1, 2023",34
OnePlus Nord N30,Michael Kelly,4.0,good,"July 8, 2024",35
OnePlus Nord N30,Wayward Canadian,5.0,phone best budget phone value extremely long battery life reallllly fastcharging exceptional stereo speakers cpu qualcomm snapdragon allows multitask good speed biggest downside phone camera take good photos daytime take good photos dimly lit situations ok never use smartphone take important celebration photos always taken canon nikon camera,"June 29, 2024",36
OnePlus Nord N30,Lalit singh,5.0,like good performance far charging fast easy pair good product overall,"August 3, 2024",37
OnePlus Nord N30,Surfer90094,4.0,replaced broken oneplus older premium higher class oneplus phone paid lot less phone say specwise equivalent much faster internet access g satisfied phone except one aspect oneplus little slider go bed slide vibrate one totally silent position phone go sign swipe swipe twice get disturb button click set schedule automatically wish solve problem go movie dont want annoy others overall money great phone,"January 22, 2024",38
OnePlus Nord N30,brookhal,5.0,first performance wont get top tier performance box tweak settings get best performance setting like get gaming media utilities super fast speeds fluidity screen goes hz basically computer monitor pocket inches screen real estate quite shock upgrade coming years owning small expensive iphones mention transfer iphone oneplus super seamless photos messages passwords transfered without issue setup screen shows much thought quality nord n g truly theme phone called oxygen os reminds iphone themes could get jailbreaking phone paying rd party software included new interface icons sounds would cost money included proud ownship phone another surprising feature included thin screen protector always protecting phone dont buy another one want buy recommend protect screen protector thin scratch regular use screen incredible well mentioned hz screen see colors brightness even lowish settings night bright screen old iphone could top sedan modern car touch screen console find android auto far better apple carplay compatibility nord n car great interface get android auto much superior carplay much carplay looks like childs play comparison overall underdog device offers premium features like oneplus done huge favor people arent looking spend new device ty incredible phone,"October 12, 2023",39
OnePlus Nord N30,Ross,5.0,everything fabulous phone sudden quit taking calls company work might carrier happy night photos feel need play settings sound day photos awesome easy set good phone price,"July 8, 2024",40
OnePlus Nord N30,forest,5.0,surprised n ive using samsung phones years wanted try something new wasnt let n phone seems responsive screen extremely brightit comes screen protector installed charger something samsung dothis considered lower end phone everything could ask imagine flagships likeone,"June 24, 2024",41
OnePlus Nord N30,Drew,4.0,correction battery bad sims activated draining battery deactivated second sim battery operated normally days use display sound good nice phone,"May 16, 2024",42
OnePlus Nord N30,Roy,5.0,tiene memoria expandible salida para audífonos las camaras son muy grandes sobresalen así que es recomendable comprar el protector de camaras con el de pantalla,"July 22, 2024",43
OnePlus Nord N30,Don Grafton,3.0,dam new phone got ta start learning functions phone old phone years know become nd nature awhile really nice decent phone way past got ta get use one thing though speed dial wth wont buy another one another years hopefully peacealso oneplus nord n phone need options reminder alerts sort flashing alert reminder nothing let know message alert missed call voice mail notification step away phone minutes come back remember check missed whatever dont like phone people drive sometime step away phone minute two indication missed anything upgrade would top tier phone opinion almost want return phone cause missing important feature old phone feature setting alertnotification every minutes answer respond alertnotification lg stylo plus man miss phone g phone oneplus need step nord n others wthis feature,"March 5, 2024",44
OnePlus Nord N30,Pedro J Torres,3.0,dont need phone things quickly dont mind photos low mid quality fine youre used older flagship phone youll probably disappointed battery life pretty good phones fingerprint reader right wrong spot youre left handed time putting left pocket unlocked running simply finger touches sensor natural spot finger lay overall phone gets things done impressive category,"July 24, 2024",45
OnePlus Nord N30,Pedro J Torres,5.0,everything would think high endcost phone would fraction price seriously hands beast tad bigger expected camera meh fine cause im huge taking photos def made big battery lastly huuuuge appreciation everything assorted easily overbearingly customizable settings etc,"June 28, 2024",46
